{
  "asset_id": "inter-black-fcfa24a6",
  "domain": "ui_assets",
  "asset_type": "font",
  "usage_policy": "review_required",
  "files": {
    "file_path": "E:\\DataBase\\domains\\ui_assets\\raw\\review_required\\fonts\\Inter-Black.woff2",
    "preview_path": "",
    "original_path": "F:\\materials\\09_fonts_字体\\inter\\docs\\font-files\\Inter-Black.woff2",
    "sha1": "fcfa24a681ec84c8c2696bdeecfad9f14a438df9",
    "size_bytes": 111668,
    "extension": ".woff2"
  },
  "source": {
    "name": "local import",
    "url": "",
    "captured_at": "2026-04-26T10:40:06.524013+00:00",
    "notes": "Imported by scripts/ui_assets/ingest_assets.py"
  },
  "license": {
    "label": "review required",
    "notes": "Review each font license before direct use."
  },
  "style_tags": [
    "dark"
  ],
  "use_cases": [],
  "avoid_when": [],
  "implementation_notes": [],
  "quality": {
    "curation_status": "new",
    "notes": "Review usage_policy and license before direct project use."
  },
  "retrieval": {
    "ai_summary": "font asset for dark. Review usage policy before use.",
    "prompt_tags": [
      "dark",
      "font"
    ],
    "negative_prompt_tags": []
  }
}
