{
  "asset_id": "geistmono-variable-b75ca5c7",
  "domain": "ui_assets",
  "asset_type": "font",
  "usage_policy": "review_required",
  "files": {
    "file_path": "E:\\DataBase\\domains\\ui_assets\\raw\\review_required\\fonts\\GeistMono-Variable.ttf",
    "preview_path": "",
    "original_path": "F:\\materials\\09_fonts_字体\\geist-font\\fonts\\GeistMono-Variable.ttf",
    "sha1": "b75ca5c7c2aea285982d6156756cecf81979c7cd",
    "size_bytes": 171968,
    "extension": ".ttf"
  },
  "source": {
    "name": "local import",
    "url": "",
    "captured_at": "2026-04-26T10:40:06.486423+00:00",
    "notes": "Imported by scripts/ui_assets/ingest_assets.py"
  },
  "license": {
    "label": "review required",
    "notes": "Review each font license before direct use."
  },
  "style_tags": [],
  "use_cases": [],
  "avoid_when": [],
  "implementation_notes": [],
  "quality": {
    "curation_status": "new",
    "notes": "Review usage_policy and license before direct project use."
  },
  "retrieval": {
    "ai_summary": "font asset for font. Review usage policy before use.",
    "prompt_tags": [
      "font"
    ],
    "negative_prompt_tags": []
  }
}
