{
  "asset_id": "1-6-7aea0fe3",
  "domain": "ui_assets",
  "asset_type": "motion_reference",
  "usage_policy": "inspiration_only",
  "files": {
    "file_path": "E:\\DataBase\\domains\\ui_assets\\raw\\inspiration_only\\videos\\1 (6).mp4",
    "preview_path": "",
    "original_path": "F:\\materials\\02_videos_动态视频\\1 (6).mp4",
    "sha1": "7aea0fe3e54a53a252ab65891ce51f2e6e7ccb4c",
    "size_bytes": 1831843,
    "extension": ".mp4"
  },
  "source": {
    "name": "local import",
    "url": "",
    "captured_at": "2026-04-26T10:40:03.882449+00:00",
    "notes": "Imported by scripts/ui_assets/ingest_assets.py"
  },
  "license": {
    "label": "reference only",
    "notes": "Motion reference only; do not reuse video files directly in projects."
  },
  "style_tags": [],
  "use_cases": [],
  "avoid_when": [],
  "implementation_notes": [],
  "quality": {
    "curation_status": "new",
    "notes": "Review usage_policy and license before direct project use."
  },
  "retrieval": {
    "ai_summary": "motion reference asset for motion reference. Review usage policy before use.",
    "prompt_tags": [
      "motion-reference"
    ],
    "negative_prompt_tags": []
  }
}
