{
  "asset_id": "reference2-10-2dfdeb00",
  "domain": "ui_assets",
  "asset_type": "screenshot_reference",
  "usage_policy": "inspiration_only",
  "files": {
    "file_path": "E:\\DataBase\\domains\\ui_assets\\raw\\inspiration_only\\screenshots\\reference2 (10).jpg",
    "preview_path": "",
    "original_path": "F:\\materials\\08_screenshots_优秀界面截图\\reference2 (10).jpg",
    "sha1": "2dfdeb00fdbe01d4a549f7ead25b2e98d595dd79",
    "size_bytes": 345371,
    "extension": ".jpg"
  },
  "source": {
    "name": "local import",
    "url": "",
    "captured_at": "2026-04-26T10:40:04.043959+00:00",
    "notes": "Imported by scripts/ui_assets/ingest_assets.py"
  },
  "license": {
    "label": "reference only",
    "notes": "Screenshot reference only; do not copy brand or commercial UI assets."
  },
  "style_tags": [
    "liquid-glass",
    "floating-navbar",
    "SaaS-hero",
    "dashboard-preview"
  ],
  "use_cases": [
    "liquid glass component inspiration",
    "button kit reference",
    "glass card system"
  ],
  "avoid_when": [
    "Do not copy this reference asset into deliverables when usage_policy is inspiration_only.",
    "Do not treat reference screenshots or videos as licensed product assets."
  ],
  "implementation_notes": [
    "Usage policy: inspiration_only. Use this asset only as visual reference; do not copy the screenshot or video into a project.",
    "When no direct_use asset is available, recreate the style with original CSS, SVG, Canvas, WebGL, or generated implementation assets.",
    "Use the tags as style retrieval hints, then build original UI/material/motion in the target project.",
    "For Liquid Glass styles, recreate with backdrop-filter, translucent layers, gradient rim borders, and contrast-safe text.",
    "For video/background inspiration, recreate with original gradients, particles, Canvas/WebGL, or licensed/generated media."
  ],
  "quality": {
    "curation_status": "reviewed",
    "notes": "Enriched for style retrieval. Asset remains governed by usage_policy."
  },
  "retrieval": {
    "ai_summary": "Liquid Glass screenshot reference for high-end buttons, floating navigation, translucent panels, soft refraction, and premium SaaS UI controls. This is inspiration_only: use it as reference only and recreate the style with original CSS/SVG/Canvas/media.",
    "prompt_tags": [
      "screenshot-reference",
      "liquid-glass",
      "floating-navbar",
      "SaaS-hero",
      "dashboard-preview",
      "dark-cinematic",
      "giant-typography",
      "bento-grid",
      "editorial-layout",
      "portfolio-inspiration",
      "reference2 (10)"
    ],
    "negative_prompt_tags": [
      "copy-asset-directly",
      "unlicensed-direct-use",
      "brand-copying"
    ]
  }
}
