{
  "asset_id": "1-5-c0b8e9a4",
  "domain": "ui_assets",
  "asset_type": "motion_reference",
  "usage_policy": "inspiration_only",
  "files": {
    "file_path": "E:\\DataBase\\domains\\ui_assets\\raw\\inspiration_only\\videos\\1 (5).mp4",
    "preview_path": "",
    "original_path": "F:\\materials\\02_videos_动态视频\\1 (5).mp4",
    "sha1": "c0b8e9a4b8d30ed4a481a43fe5413fb078438f4b",
    "size_bytes": 20321722,
    "extension": ".mp4"
  },
  "source": {
    "name": "local import",
    "url": "",
    "captured_at": "2026-04-26T10:40:03.872855+00:00",
    "notes": "Imported by scripts/ui_assets/ingest_assets.py"
  },
  "license": {
    "label": "reference only",
    "notes": "Motion reference only; do not reuse video files directly in projects."
  },
  "style_tags": [
    "motion-reference",
    "hero-background",
    "cinematic-loop"
  ],
  "use_cases": [
    "product device showcase",
    "robotics hero motion"
  ],
  "avoid_when": [
    "Do not copy this reference asset into deliverables when usage_policy is inspiration_only.",
    "Do not treat reference screenshots or videos as licensed product assets."
  ],
  "implementation_notes": [
    "Usage policy: inspiration_only. Use this asset only as visual reference; do not copy the screenshot or video into a project.",
    "When no direct_use asset is available, recreate the style with original CSS, SVG, Canvas, WebGL, or generated implementation assets.",
    "Use the tags as style retrieval hints, then build original UI/material/motion in the target project.",
    "For Liquid Glass styles, recreate with backdrop-filter, translucent layers, gradient rim borders, and contrast-safe text.",
    "For video/background inspiration, recreate with original gradients, particles, Canvas/WebGL, or licensed/generated media."
  ],
  "quality": {
    "curation_status": "reviewed",
    "notes": "Enriched for style retrieval. Asset remains governed by usage_policy."
  },
  "retrieval": {
    "ai_summary": "Product showcase motion reference with device/robotic arm composition for premium hardware, robotics, and developer product heroes. This is inspiration_only: use it as reference only and recreate the style with original CSS/SVG/Canvas/media.",
    "prompt_tags": [
      "motion-reference",
      "hero-background",
      "cinematic-loop",
      "ambient-motion",
      "glass-refraction",
      "particle-background",
      "gradient-motion",
      "1 (5)"
    ],
    "negative_prompt_tags": [
      "copy-asset-directly",
      "unlicensed-direct-use",
      "brand-copying"
    ]
  }
}
