{
  "asset_id": "inter-thinitalic-c49b520a",
  "domain": "ui_assets",
  "asset_type": "font",
  "usage_policy": "review_required",
  "files": {
    "file_path": "E:\\DataBase\\domains\\ui_assets\\raw\\review_required\\fonts\\Inter-ThinItalic.woff2",
    "preview_path": "",
    "original_path": "F:\\materials\\09_fonts_字体\\inter\\docs\\font-files\\Inter-ThinItalic.woff2",
    "sha1": "c49b520ab7e7d9ec7a96a094c1775fde34233954",
    "size_bytes": 116880,
    "extension": ".woff2"
  },
  "source": {
    "name": "local import",
    "url": "",
    "captured_at": "2026-04-26T10:40:06.553996+00:00",
    "notes": "Imported by scripts/ui_assets/ingest_assets.py"
  },
  "license": {
    "label": "review required",
    "notes": "Review each font license before direct use."
  },
  "style_tags": [],
  "use_cases": [],
  "avoid_when": [],
  "implementation_notes": [],
  "quality": {
    "curation_status": "new",
    "notes": "Review usage_policy and license before direct project use."
  },
  "retrieval": {
    "ai_summary": "font asset for font. Review usage policy before use.",
    "prompt_tags": [
      "font"
    ],
    "negative_prompt_tags": []
  }
}
