{
  "asset_id": "reference1-18-1d024d05",
  "domain": "ui_assets",
  "asset_type": "screenshot_reference",
  "usage_policy": "inspiration_only",
  "files": {
    "file_path": "E:\\DataBase\\domains\\ui_assets\\raw\\inspiration_only\\screenshots\\reference1 (18).png",
    "preview_path": "",
    "original_path": "F:\\materials\\08_screenshots_优秀界面截图\\reference1 (18).png",
    "sha1": "1d024d05475c0cee5e479b138fcd93ce2e41302c",
    "size_bytes": 830996,
    "extension": ".png"
  },
  "source": {
    "name": "local import",
    "url": "",
    "captured_at": "2026-04-26T10:40:04.008730+00:00",
    "notes": "Imported by scripts/ui_assets/ingest_assets.py"
  },
  "license": {
    "label": "reference only",
    "notes": "Screenshot reference only; do not copy brand or commercial UI assets."
  },
  "style_tags": [
    "editorial-layout",
    "portfolio-inspiration",
    "SaaS-hero"
  ],
  "use_cases": [
    "city/vision portfolio hero",
    "future technology landing"
  ],
  "avoid_when": [
    "Do not copy this reference asset into deliverables when usage_policy is inspiration_only.",
    "Do not treat reference screenshots or videos as licensed product assets."
  ],
  "implementation_notes": [
    "Usage policy: inspiration_only. Use this asset only as visual reference; do not copy the screenshot or video into a project.",
    "When no direct_use asset is available, recreate the style with original CSS, SVG, Canvas, WebGL, or generated implementation assets.",
    "Use the tags as style retrieval hints, then build original UI/material/motion in the target project.",
    "For Liquid Glass styles, recreate with backdrop-filter, translucent layers, gradient rim borders, and contrast-safe text.",
    "For video/background inspiration, recreate with original gradients, particles, Canvas/WebGL, or licensed/generated media."
  ],
  "quality": {
    "curation_status": "reviewed",
    "notes": "Enriched for style retrieval. Asset remains governed by usage_policy."
  },
  "retrieval": {
    "ai_summary": "Editorial technology landing screenshot with scenic media background, understated navbar, strong headline, and portfolio-style CTA. This is inspiration_only: use it as reference only and recreate the style with original CSS/SVG/Canvas/media.",
    "prompt_tags": [
      "screenshot-reference",
      "editorial-layout",
      "portfolio-inspiration",
      "SaaS-hero",
      "dark-cinematic",
      "liquid-glass",
      "floating-navbar",
      "giant-typography",
      "bento-grid",
      "dashboard-preview",
      "reference1 (18)"
    ],
    "negative_prompt_tags": [
      "copy-asset-directly",
      "unlicensed-direct-use",
      "brand-copying"
    ]
  }
}
